{"behavior_version":"sha256:239704ca0c6adb178678928ccff28a30cc442a56de7fab4a983cd4cd0111b6ef","context":{},"data_version":"store:sha256:dafa8366a7e90e6eeb51868c7f54ff5fcc65c6abd1deb86f5d10e3d5d5dcf496;state:sha256:d183f5f766154fc5eaba444897e74b990f80da32dc41ea7cd052d494c8218e2c;position:0","derived":[],"facts":{"universe":[{"entity":"Culture","members":[{"id":"c1","measurements":7}]}]},"format":"behavior.read_record.v2","input":{},"observed":[["c","measurements"]],"read":{"declared":true,"hash":"sha256:d5fa00d472d0bf586775558ed1c25a34df44527f0c96751a340c7d94c5bdda69","name":"inspect"},"record_id":"read:sha256:56db30540201c2195f5cd78a6315a4a2facdf62377865b942b4efe71c82a7c0a","result":"VALUE","state":{"c":{"id":"c1","measurements":7}},"value":7}